{
  "lifecycleVersion": 1,
  "defaultReviewPeriodDays": 180,
  "defaultDraftApprovalDays": 30,
  "policies": [
    {
      "slug": "ai-use-case-risk-intake",
      "owner": "Enterprise Risk and AI Governance",
      "status": "draft",
      "introducedOn": "2026-08-10",
      "reviewDueOn": "2026-09-09",
      "policyVersion": "1.0.4",
      "fingerprint": "sha256:4b6c8e0fc469ee6b2b2d89815e97b63a7c7555545a14f57646dabc65c0c46356"
    },
    {
      "slug": "campaign-lead-compliance-gate",
      "owner": "Marketing Operations",
      "status": "draft",
      "introducedOn": "2026-08-08",
      "reviewDueOn": "2026-09-07",
      "policyVersion": "1.0.4",
      "fingerprint": "sha256:541b099f3ef285dbe060625d4a05b0bfd79eee090cbc4d82741f01cc94034822"
    },
    {
      "slug": "contract-intake-routing",
      "owner": "Legal Operations",
      "status": "draft",
      "introducedOn": "2026-08-08",
      "reviewDueOn": "2026-09-07",
      "policyVersion": "1.0.4",
      "fingerprint": "sha256:10aa36610499497f0a32bbad3c29e3b77ff22b46c206dfdcd44d7966de896b13"
    },
    {
      "slug": "customer-risk-escalation",
      "owner": "Customer Success Operations",
      "status": "draft",
      "introducedOn": "2026-08-08",
      "reviewDueOn": "2026-09-07",
      "policyVersion": "1.0.4",
      "fingerprint": "sha256:eae76dfee6af7b72cb973defaad623403d02beba0907b8464865478a4bd7734f"
    },
    {
      "slug": "data-access-request-triage",
      "owner": "Data Governance",
      "status": "draft",
      "introducedOn": "2026-08-08",
      "reviewDueOn": "2026-09-07",
      "policyVersion": "1.0.4",
      "fingerprint": "sha256:6567ff8f1d1d84ef94367228a98157b11ef765bb53f1e6edd22bd64cd5de7e91"
    },
    {
      "slug": "data-subject-request-triage",
      "owner": "Privacy Operations",
      "status": "draft",
      "introducedOn": "2026-08-08",
      "reviewDueOn": "2026-09-07",
      "policyVersion": "1.0.4",
      "fingerprint": "sha256:a87f23a022557aa59256bb5e5ffc695be89f5dcaa43c833071d4419a1d673404"
    },
    {
      "slug": "employee-access-request-triage",
      "owner": "People Operations and Identity Management",
      "status": "draft",
      "introducedOn": "2026-08-08",
      "reviewDueOn": "2026-09-07",
      "policyVersion": "1.0.4",
      "fingerprint": "sha256:8a69fa582f98fff6c53c2191389be4f5ef05ef816dd3b6979c877aef9ba17818"
    },
    {
      "slug": "enterprise-lead-routing",
      "owner": "Revenue Operations",
      "status": "draft",
      "introducedOn": "2026-08-08",
      "reviewDueOn": "2026-09-07",
      "policyVersion": "1.0.4",
      "fingerprint": "sha256:aaba8cbcaa4e27e90d32192197825bc1f80418ced47072e2ccaf72685952864d"
    },
    {
      "slug": "external-communication-approval",
      "owner": "Corporate Communications",
      "status": "draft",
      "introducedOn": "2026-08-08",
      "reviewDueOn": "2026-09-07",
      "policyVersion": "1.0.4",
      "fingerprint": "sha256:da470f635422abfa062d3496966070621413fbc7344f329e29bbc3881bc0300b"
    },
    {
      "slug": "invoice-exception-triage",
      "owner": "Accounts Payable Operations",
      "status": "draft",
      "introducedOn": "2026-08-08",
      "reviewDueOn": "2026-09-07",
      "policyVersion": "1.0.4",
      "fingerprint": "sha256:bf44281b1046fc732589a0d936e04ff1023ae938d68edfe2ffaca42faa4af5c2"
    },
    {
      "slug": "major-incident-stakeholder-brief",
      "owner": "Business Operations and Incident Command",
      "status": "draft",
      "introducedOn": "2026-08-08",
      "reviewDueOn": "2026-09-07",
      "policyVersion": "1.0.4",
      "fingerprint": "sha256:ec22e5a998af6868fabab9842d037db7c81e53123267a21f3e08ac38965be6b5"
    },
    {
      "slug": "phishing-report-triage",
      "owner": "Security Operations",
      "status": "draft",
      "introducedOn": "2026-08-08",
      "reviewDueOn": "2026-09-07",
      "policyVersion": "1.0.4",
      "fingerprint": "sha256:34f28d9eb4a5a84e9cc387e49c22c695d57065e966872280cab19654b329666e"
    },
    {
      "slug": "production-change-risk-gate",
      "owner": "Engineering Operations",
      "status": "draft",
      "introducedOn": "2026-08-08",
      "reviewDueOn": "2026-09-07",
      "policyVersion": "1.0.4",
      "fingerprint": "sha256:56322898d103d640ed81377f1f5bd75882169f0e2b517bcd89f4d90537da834b"
    },
    {
      "slug": "service-desk-priority-routing",
      "owner": "IT Service Management",
      "status": "draft",
      "introducedOn": "2026-08-08",
      "reviewDueOn": "2026-09-07",
      "policyVersion": "1.0.4",
      "fingerprint": "sha256:43a4c67f460ab1ed943729624295264f8ee49c3d2fbfc2229146700397656685"
    },
    {
      "slug": "vendor-risk-intake",
      "owner": "Procurement Operations",
      "status": "draft",
      "introducedOn": "2026-08-08",
      "reviewDueOn": "2026-09-07",
      "policyVersion": "1.0.4",
      "fingerprint": "sha256:7ab1be1b0add1f4a2d3616787338e588ec9b7b2ddf956133e5676951764e2e66"
    },
    {
      "slug": "workplace-incident-routing",
      "owner": "Workplace Operations",
      "status": "draft",
      "introducedOn": "2026-08-08",
      "reviewDueOn": "2026-09-07",
      "policyVersion": "1.0.4",
      "fingerprint": "sha256:2421aadf64ce645d048164ba88c5fc165524b0285c7b6fec9704a176216dbdd6"
    }
  ]
}
